161,National Cemetery Administration,,,,,,National Cemetery Administration,Department of Veterans Affairs,,,,Cemetary Administration,162,National Commission on Libraries and Information Science,,,National Commission on Libraries and Information Science,,,,National Commission on Libraries and Information Science,3130,3130,NCLIS,Commission on Libraries and Information Science,163,National Consumer Cooperative Bank,,,National Consumer Cooperative Bank,,,,National Consumer Cooperative Bank,,,,Consumer Cooperative Bank,164,National Council on Disability,,national council on disability,National Council on Disability,,,,National Council on Disability,3480,3480,NCD,Council on Disability,165,National Council on the Arts,,,National Council on the Arts,,,,National Endowment for the Arts,,,,Council on the Arts,166,National Council on the Humanities,,,National Council on the Humanities,,,,National Endowment for the Humanities,,,,Council on the Humanities,167,National Credit Union Administration,National Credit Union Administration,national credit union administration,NATIONAL CREDIT UNION ADMINISTRATION,National Credit Union Administration,,National Credit Union Administration,National Credit Union Administration,3133,3133,NCUA,Credit Union Administration,168,National Endowment for the Arts,National Foundation on the Arts and the Humanities,,,,,,National Endowment for the Arts,3135,3135,NEA,Endowment for the Arts,169,National Endowment for the Humanities,National Foundation on the Arts and the Humanities,,,,,,National Endowment for the Humanities,3136,3136,NEH,Endowment for the Humanities,170,National Foundation on Arts and Humanities,,,NATIONAL FOUNDATION ON ARTS AND HUMANITIES,National Foundation on the Arts and the Humanities,,National Foundation on the Arts and the Humanities,National Foundation on Arts and Humanities,,,,Foundation on Arts and Humanities,Foundation on the Arts and Humanities171,National Guard Bureau,,,,,,National Guard Bureau,Department of Defense,,,,National Guard,172,National Highway Traffic Safety Administration,,,,,,National Highway Traffic Safety Administration,Department of Transportation,2127,2100,NHTSA,,173,National Indian Gaming Commission,,,National Indian Gaming Commission,,,,National Indian Gaming Commission,3141,3141,NIGC,Indian Gaming Commission,174,National Institute for Literacy,,,National Institute for Literacy,,,,National Institute for Literacy,3430,3430,NIFL,Institute for Literacy,175,National Institute of Building Sciences,,,National Institute of Building Sciences,,,,National Institute of Building Sciences,3138,3138,,Institute of Building Sciences,176,National Institute of Standards and Technology,,,,,,National Institute of Standards and Technology,Department of Commerce,693,600,NIST,Institute of Standards and Technology,177,National Institutes of Health,,,,,,National Institutes of Health,Department of Health and Human Services,925,900,NIH,,178,National Labor Relations Board,National Labor Relations Board,national labor relations board,National Labor Relations Board,,,National Labor Relations Board,National Labor Relations Board,3142,3142,NLRB,Labor Relations Board,179,National Mediation Board,National Mediation Board,national mediation board,NATIONAL MEDIATION BOARD,National Mediation Board,,,National Mediation Board,3140,3140,NMB,Mediation Board,180,National Museum and Library Services Board,,,National Museum and Library Services Board,National Museum Services Board,,,Institute for Museum and Library Services,,,NMLSB,Museum and Library Services Board,181,National Nuclear Security Administration,,,,,,National Nuclear Security Administration,Department of Energy,,,NNSA,Nuclear Security Administration,182,National Oceanic and Atmospheric Administration,,,,,,National Oceanic and Atmospheric Administration,Department of Commerce,648,600,NOAA,,183,National Park Service,,,,,,National Park Service,Department of the Interior,1024,1000,NPS,,184,National Railroad Passenger Corporation ,,,Amtrak,,,National Railroad Passenger Corporation (AMTRAK),National Railroad Passenger Corporation (AMTRAK),,,AMTRAK,Railroad Passenger Corporation,185,National Science Foundation,National Science Foundation,national science foundation,National Science Foundation,,,National Science Foundation,National Science Foundation,3145,3145,NSF,,186,National Security Council,National Security Council,,,,,,Executive Office of the President,,,NSC,,187,National Security Education Board,,,National Security Education Board,,,,National Security Education Board,,,NSEB,,188,National Security Staff,,,,,,National Security Staff,National Security Staff,,,,,189,National Transportation Safety Board,National Transportation Safety Board,national transportation safety board,NATIONAL TRANSPORTATION SAFETY BOARD,National Transportation Safety Board,,National Transportation Safety Board,National Transportation Safety Board,3147,3147,NTSB,Transportation Safety Board,190,Natural Resources Conservation Service,,,,,,Natural Resources Conservation Service,Department of Agriculture,578,500,NRCS,,191,Nuclear Regulatory Commission,Nuclear Regulatory Commission,nuclear regulatory commission,Nuclear Regulatory Commission,,,Nuclear Regulatory Commission,Nuclear Regulatory Commission,3150,3150,NRC,,192,Occupational Safety and Health Administration,,,,,,Occupational Safety and Health Administration,Department of Labor,1218,1200,OSHA,,193,Occupational Safety and Health Review Commission,Occupational Safety and Health Review Commission,,OCCUPATIONAL SAFETY AND HEALTH REVIEW COMMISSION,Occupational Safety and Health Review Commission,,,Occupational Safety and Health Review Commission,3202,3202,OSHRC,,194,Office of Administration,Office of Administration,office of administration,,,,,Executive Office of the President,,,,,195,Office of Electricity Delivery and Energy Reliability,,,,,,Office of Electricity Delivery and Energy Reliability,Department of Energy,,,,,196,Office of Elementary and Secondary Education,,,,,,Office of Elementary and Secondary Education,Department of Education,1810,1800,OESE,,197,Office of Energy Efficiency and Renewable Energy,,,,,,Office of Energy Efficiency and Renewable Energy,Department of Energy,1904,1900,EERE,,198,Office of Environmental Management,,,,,,Office of Environmental Management,Department of Energy,,,,,199,Office of Federal Housing Enterprise Oversight,,,,,,,Office of Federal Housing Enterprise Oversight,2550,,OFHEO,Federal Housing Enterprise Oversight,200,Office of Federal Student Aid,,,,,,Office of Federal Student Aid,Department of Education,1845,1800,,,201,Office of Fossil Energy,,,,,,Office of Fossil Energy,Department of Energy,,,,,202,Office of Government Ethics,Office of Government Ethics,,OFFICE OF GOVERNMENT ETHICS,Office of Government Ethics,,Office of Government Ethics,Office of Government Ethics,3209,3209,OGE,,203,Office of Legal Counsel,,,,,,Office of Legal Counsel,Department of Justice,,,,,204,Office of Management and Budget,Office of Management and Budget,office of management and budget,,,,Office of Management and Budget,Executive Office of the President,348,300,OMB,,205,Office of National Drug Control Policy,Office of National Drug Control Policy,,,,,Office of National Drug Control Policy,Executive Office of the President,3201,3201,ONDCP,,206,Office of Navajo and Hopi Indian Relocation,,,,,,,Office of Navajo and Hopi Indian Relocation,,,,,207,Office of Nuclear Energy,,,,,,Office of Nuclear Energy,Department of Energy,,,,,208,Office of Personnel Management,Office of Personnel Management,office of personnel management,OFFICE OF PERSONNEL MANAGEMENT,Office of Personnel Management,,Office of Personnel Management,Office of Personnel Management,3206,3206,OPM,,209,Office of Postsecondary Education,,,,,,Office of Postsecondary Education,Department of Education,1840,1800,OPE,,210,Office of Science,,,,,,Office of Science,Department of Energy,,,,,211,Office of Science and Technology,Office of Science and Technology Policy,,,,,Office of Science and Technology Policy,Executive Office of the President,349,300,OSTP,,212,Office of Special Counsel,Office of Special Counsel,,OFFICE OF SPECIAL COUNSEL,Office of Special Counsel,,Office of Special Counsel,Office of Special Counsel,3255,3255,OSC,,213,Office of the Comptroller of the Currency,,,,,,Office of the Comptroller of the Currency,Department of the Treasury,1557,1500,OCC,Comptroller of the Currency,214,Office of the Director of National Intelligence,,,Office of the Director of National Intelligence,,,Office of the Director of National Intelligence,Office of the Director of National Intelligence,,,ODNI,Director of National Intelligence,215,Office of the Federal Coordinator for Alaska Natural Gas Transportation Projects,,,Office of the Federal Coordinator for Alaska Natural Gas Transportation Projects,,,,Office of the Federal Coordinator for Alaska Natural Gas Transportation Projects,,,,Alaska Natural Gas Transportation Projects,216,Office of the President,,office of the president,,,,,Executive Office of the President,,,,,217,Office of the Secretary of Defense,,,,,,Office of the Secretary of Defense,Department of Defense,790,700,,Secretary of Defense,218,Office of the United States Trade Representative,Office of the U.S. Trade Representative,,,,,Office of the United States Trade Representative,Executive Office of the President,350,300,USTR,Office of the Trade Representative,219,Overseas Private Investment Corporation,Overseas Private Investment Corporation,,OVERSEAS PRIVATE INVESTMENT CORPORATION,,,Overseas Private Investment Corporation,Overseas Private Investment Corporation,3420,3420,OPIC,,220,Panama Canal Commission,,panama canal commission,,,,,Panama Canal Commission,3207,3207,,,221,Peace Corps,Peace Corps,peace corps,Peace Corps,,,Peace Corps,Peace Corps,420,420,,,222,Pennsylvania Avenue Development Corporation,Pennsylvania Avenue Development Corporation,,,,,,Pennsylvania Avenue Development Corporation,3208,3208,PADC,,223,Pension Benefit Guaranty Corporation,Pension Benefit Guarantee Corporation,pension benefit guaranty corporation,PENSION BENEFIT GUARANTY CORPORATION,Pension Benefit Guaranty Corporation,,,Pension Benefit Guaranty Corporation,1212,1212,PBGC,,224,Political Affairs,,,,,,Political Affairs,Department of State,,,,,225,Postal Regulatory Commission,,postal rate commission,,,,,Postal Regulatory Commission,3211,3211,PRC,Postal Rate Commission,226,President's Commission on White House Fellowships,,,PRESIDENT'S COMMISSION ON WHITE HOUSE FELLOWSHIPS,,,,President's Commission on White House Fellowships,,,,Commission on White House Fellowships,227,Presidio Trust,,,,,,,Presidio Trust,3212,,,,228,Privacy and Civil Liberties Oversight Board,,,Privacy and Civil Liberties Oversight Board,,,,Privacy and Civil Liberties Oversight Board,311,311,PCLOB,Privacy and Civil Liberties Oversight,229,Public Diplomacy and Public Affairs,,,,,,Public Diplomacy and Public Affairs,Department of State,,,,,230,Railroad Retirement Board,Railroad Retirement Board,railroad retirement board,Railroad Retirement Board,,,,Railroad Retirement Board,3220,3220,RRB,,231,Recovery Accountability and Transparency Board,,,,,,,Recovery Accountability and Transparency Board,430,,,,232,Rural Housing Service,,,,,,Rural Housing Service,Department of Agriculture,575,500,RHS,,233,Saint Lawrence Seaway Development Corporation,,,Saint Lawrence Seaway Development Corporation,,,,Department of Transportation,2135,2100,SLSDC,,234,Secret Service,,,,,,Secret Service,Department of Homeland Security,1620,1600,,,235,Securities and Exchange Commission,Securities and Exchange Commission,securities and exchange commission,SECURITIES AND EXCHANGE COMMISSION,Securities and Exchange Commission,,Securities and Exchange Commission,Securities and Exchange Commission,3235,3235,SEC,,236,Securities Investor Protection Corporation,,,Securities Investor Protection Corporation,,,,Securities Investor Protection Corporation,,,SIPC,,237,Selective Service System,,selective service system,SELECTIVE SERVICE SYSTEM,Selective Service System,,,Selective Service System,3240,3240,,,238,Small Business Administration,Small Business Administration,small business administration,SMALL BUSINESS ADMINISTRATION,Small Business Administration,,Small Business Administration,Small Business Administration,3245,3245,SBA,,239,Smithsonian Institution,,smithsonian institution,,,,,Smithsonian Institution,3250,3250,,Smithsonian,240,Social Security Administration,Social Security Administration,social security administration,SOCIAL SECURITY ADMINISTRATION,Social Security Administration,,Social Security Administration,Social Security Administration,960,960,SSA,,241,Social Security Advisory Board,,,,,,,Social Security Advisory Board,,,,,242,Special Inspector General for Afghanistan Reconstruction,,,,,,,Special Inspector General for Afghanistan Reconstruction,3460,,SIGAR,Inspector General for Afghanistan Reconstruction,243,Special Panel on Appeals,,,Special Panel on Appeals,,,,Special Panel on Appeals,,,,,244,State Justice Institute,,,State Justice Institute,,,,State Justice Institute,,,SJI,,245,Surface Transportation Board,,,,,,,Surface Transportation Board,2140,2140,STB,,246,Tennessee Valley Authority,,tennessee valley authority,Tennessee Valley Authority,,,Tennessee Valley Authority,Tennessee Valley Authority,3316,3316,TVA,,247,Thrift Depositor Protection Oversight Board,,,,,,,Thrift Depositor Protection Oversight Board,3203,,,,248,Trade and Development Agency,Trade and Development Agency,,TRADE AND DEVELOPMENT AGENCY,U. S. Trade and Development Agency,United States Trade and Development Agency,,Trade and Development Agency,3330,3330,USTDA,,249,Transportation Security Administration,,,,,,Transportation Security Administration,Department of Homeland Security,1652,1600,TSA,,250,U.S. Action,Action,us action,,,,,U.S. Action,3001,3001,,,251,U.S. Census Bureau,,,,,,U.S. Census Bureau,Department of Commerce,607,600,,Census Bureau,252,U.S. Coast Guard,,u.s. coast guard,,,,Coast Guard,Department of Homeland Security,1625,1600,,Coast Guard,253,U.S. Courts,,u.s. courts,,,,,U.S. Courts,,,,,254,U.S. Fish and Wildlife Service,,,,,,U.S. Fish and Wildlife Service,Department of the Interior,1018,1000,USFWS,FWS,Fish and Wildlife Service255,U.S. Geological Survey,,,,,,U.S. Geological Survey,Department of the Interior,1028,1000,USGS,Geological Survey,256,U.S. Information Agency,,u.s. information agency,,,,,U.S. Information Agency,3116,3116,USIA,Information Agency,257,U.S. Patent and Trademark Office,,,,,,U.S. Patent and Trademark Office,Department of Commerce,651,600,USPTO,Patent and Trademark Office,258,United Nations,,,United Nations,,,,United Nations,,,,,259,United States Advisory Commission on Public Diplomacy,,,United States Advisory Commission on Public Diplomacy,,,,Department of State,,,ACPD,Advisory Commission on Public Diplomacy,260,United States African Development Foundation,African Development Foundation,,African Development Foundation,,,,United States African Development Foundation,3005,3005,USADF,African Development Foundation,261,United States Agency for International Development,U.S. Agency for International Development,agency for international development,,,,United States Agency for International Development,United States Agency for International Development,412,412,USAID,,262,United States Citizenship and Immigration Services,,,,,,United States Citizenship and Immigration Services,Department of Homeland Security,1615,1600,USCIS,Citizenship and Immigration Services,263,United States Customs and Border Protection,,,,,,United States Customs and Border Protection,Department of Homeland Security,1651,1600,CBP,Customs and Border Protection,264,United States Election Assistance Commission,,,,,,,United States Election Assistance Commission,,,EAC,Election Assistance Commission,265,United States Immigration and Customs Enforcement,,,,,,United States Immigration and Customs Enforcement,Department of Homeland Security,1653,1600,ICE,Immigration and Customs Enforcement,266,United States Institute of Peace,,,United States Institute of Peace,,,,United States Institute of Peace,,,USIP,Institute of Peace,267,United States International Development Cooperation Agency,,,United States International Development Cooperation Agency,,,,United States International Development Cooperation Agency,577,500,IDCA,International Development Cooperation Agency,268,United States International Trade Commission,U.S. International Trade Commission,united states international trade commission,UNITED STATES INTERNATIONAL TRADE COMMISSION,United States International Trade Commission,,United States International Trade Commission,United States International Trade Commission,3117,3117,USITC,International Trade Commission,269,United States Parole Commission,,,United States Parole Commission,,,,Department of Justice,1104,1100,USPC,Parole Commission,270,United States Postal Service,,u.s. postal service,United States Postal Service,,,United States Postal Service,United States Postal Service,3210,3210,USPS,Postal Service,271,United States Sentencing Commission,,,United States Sentencing Commission,,,,United States Sentencing Commission,,,,Setencing Commission,272,United States Soldiers and Airmens Home,,united states soldiers and airmens home,,,,,United States Soldiers and Airmens Home,,,,Soldiers and Airmens Home,273,United States Tax Court,,,United States Tax Court,,,,United States Tax Court,,,,Tax Court,274,Veterans Benefits Administration,,,,,,Veterans Benefits Administration,Department of Veterans Affairs,,,,,275,Veterans Health Administration,,,,,,Veterans Health Administration,Department of Veterans Affairs,,,VHA,,276,Wage and Hour Division,,,,,,Wage and Hour Division,Department of Labor,1235,1200,WHD,,