Lauren's Agency Code,Agency,Clinton Lewis Name,Chen Johnson Name,Bonica Chen Johnson Name,Bonica Chen Johnson Name 2,Bonica Chen Johnson Name 3,Richardson et al Name,Parent Agency,UA Code,Parent UA Code,acronym,synonym1,synonym21,Administration for Children and Families,,,,,,Administration for Children and Families,Department of Health and Human Services,970,900,ACF,,2,Administrative Conference of the United States,Administrative Conference of the United States,,,,,Administrative Conference of the United States,Administrative Conference of the United States,3002,3002,ACUS,Administrative Conference,3,Advisory Council on Historic Preservation,,,,,,,Advisory Council on Historic Preservation,3010,,ACHP,Council on Historic Preservation,4,Agricultural Marketing Service,,,,,,Agricultural Marketing Service,Department of Agriculture,581,500,AMS,,5,Agricultural Research Service,,,,,,Agricultural Research Service,Department of Agriculture,518,500,ARS,,6,American Battle Monuments Commission,,,,,,,American Battle Monuments Commission,3263,,,Battle Monuments Commission,7,Animal and Plant Health Inspection Service,,,,,,Animal and Plant Health Inspection Service,Department of Agriculture,579,500,APHIS,,8,Appalachian Regional Commission,Appalachian Regional Commission,,APPALACHIAN REGIONAL COMMISSION,Appalachian Regional Commission,,,Appalachian Regional Commission,3011,3011,ARC,,9,Architectural and Transportation Barriers Compliance Board,,,,,,,Architectural and Transportation Barriers Compliance Board,3014,,,,10,Arms Control and International Security,,,,,,Arms Control and International Security,Department of State,,,,,11,Asian Development Bank,,,Asian Development Bank,,,,Asian Development Bank,,,ADB,,12,Barry Goldwater Scholarship and Excellence in Education Program,,,Barry Goldwater Scholarship & Excellence in Education Foundation,,,,Barry Goldwater Scholarship and Excellence in Education Program,3019,3019,,Goldwater Scholarship,13,Board for International Broadcasting,Board for International Broadcasting,,,,,,Board for International Broadcasting,,,BIB,,14,Board of Veterans Appeals,,,,,,,Veterans Affairs,,,,Veterans Appeals,15,Broadcasting Board of Governors,Broadcasting Board of Governors/USIA,broadcasting board of governors,BROADCASTING BOARD OF GOVERNORS,Broadcasting Board of Governors,,Broadcasting Board of Governors,Broadcasting Board of Governors,3112,3112,BBG,,16,"Bureau of Alcohol, Tobacco, Firearms and Explosives",,,,,,"Bureau of Alcohol, Tobacco, Firearms and Explosives",Department of Justice,1140,1100,ATF,,17,Bureau of Consular Affairs,,,,,,Bureau of Consular Affairs,Department of State,,,,Consular Affairs,18,Bureau of Diplomatic Security,,,,,,Bureau of Diplomatic Security,Department of State,,,,Diplomatic Security,19,Bureau of Economic Analysis,,,,,,Bureau of Economic Analysis,Department of Commerce,691,600,BEA,,20,Bureau of Indian Affairs,,,,,,Bureau of Indian Affairs,Department of the Interior,1076,1000,BIA,,21,Bureau of International Narcotics and Law Enforcement Affairs,,,,,,Bureau of International Narcotics and Law Enforcement Affairs,Department of State,,,INL,International Narcotics and Law Enforcement Affairs,22,Bureau of Labor Statistics,,,,,,Bureau of Labor Statistics,Department of Labor,1220,1200,BLS,,23,Bureau of Land Management,,,,,,Bureau of Land Management,Department of the Interior,1004,1000,BLM,,24,Bureau of Prisons,,,,,,Bureau of Prisons,Department of Justice,1120,1100,BOP,,25,Bureau of Reclamation,,,,,,Bureau of Reclamation,Department of the Interior,1006,1000,,,26,Bureau of the Fiscal Service,,,,,,Bureau of the Fiscal Service,Department of the Treasury,1530,1500,,Fiscal Service,27,Centers for Disease Control and Prevention,,,,,,Centers for Disease Control and Prevention,Department of Health and Human Services,920,900,CDC,,28,Centers for Medicare and Medicaid Services,,,Centers for Medicare and Medicaid Services,,,Centers for Medicare and Medicaid Services,Department of Health and Human Services,938,900,CMS,,29,Central Intelligence Agency,,,Central Intelligence Agency,,,Central Intelligence Agency,Central Intelligence Agency,,,CIA,,30,Chemical Safety and Hazard Investigation Board,,,CHEMICAL SAFETY AND HAZARD INVESTIGATION BOARD,Chemical Safety and Hazard Investigation Board,,,Chemical Safety and Hazard Investigation Board,,,CSB,,31,Civil Service Commission,,civil service commission,,,,,Civil Service Commission,,,,,32,"Civilian Security, Democracy, and Human Rights",,,,,,"Civilian Security, Democracy, and Human Rights",Department of State,,,,,33,Commission on Civil Rights,Commission on Civil Rights,commission on civil rights,COMMISSION ON CIVIL RIGHTS,,,,Commission on Civil Rights,3035,3035,USCCR,,34,Committee for Purchase From People Who Are Blind or Severely Disabled,,,,,,,Committee for Purchase From People Who Are Blind or Severely Disabled,3037,,CPPBSD,,35,Commodities Futures Trading Commission,Commodity Futures Trading Commission,commodity futures trading commission,COMMODITY FUTURES TRADING COMMISSION,Commodity Futures Trading Commission,,Commodity Futures Trading Commission,Commodities Futures Trading Commission,3038,3038,CFTC,,36,Commodity Credit Corporation,,,Commodity Credit Corporation,,,,Commodity Credit Corporation,566,500,CCC,,37,Consumer Financial Protection Bureau,,,,,,Consumer Financial Protection Bureau,Consumer Financial Protection Bureau,3170,3170,CFPB,,38,Consumer Product Safety Commission,Consumer Product Safety Commission,consumer product safety commission,CONSUMER PRODUCT SAFETY COMMISSION,Consumer Product Safety Commission,,Consumer Product Safety Commission,Consumer Product Safety Commission,3041,3041,CPSC,,39,Corporation for National Community Service,Corporation for National and Community Service,,Corporation for National and Community Service,,,Corporation for National and Community Service,Corporation for National Community Service,3045,3045,CNCS,,40,Corporation for Public Broadcasting,,,Corporation for Public Broadcasting,,,,Corporation for Public Broadcasting,,,CPB,,41,Council of Economic Advisors,Council of Economic Advisers,,,,,Council of Economic Advisers,Council of Economic Advisors,,,CEA,,42,Council of the Inspectors General on Integrity and Efficiency,,,,,,,Council of the Inspectors General on Integrity and Efficiency,3219,,CIGIE,Inspectors General on Integrity and Efficiency,43,Council on Environmental Quality,Council on Environmental Quality,,,,,Council on Environmental Quality,Council on Environmental Quality,331,300,CEQ,,44,Court Services and Offender Supervision Agency,,court services and offender supervision agency,,,,,Court Services and Offender Supervision Agency,3225,3225,CSOSA,,45,Defense Advanced Research Projects Agency,,,,,,Defense Advanced Research Projects Agency,Department of Defense,,,DARPA,,46,Defense Base Closure and Realignment Commission,,,Defense Base Closure and Realignment Commission,,,,Department of Defense,,,BRAC,,47,Defense Commissary Agency,,,,,,Defense Commissary Agency,Department of Defense,,,DeCA,,48,Defense Contract Audit Agency,,,,,,Defense Contract Audit Agency,Department of Defense,,,DCAA,,49,Defense Contract Management Agency,,,,,,Defense Contract Management Agency,Department of Defense,,,DCMA,,50,Defense Finance and Accounting Service,,,,,,Defense Finance and Accounting Service,Department of Defense,730,700,DFAS,,51,Defense Health Agency,,,,,,Defense Health Agency,Department of Defense,,,DHA,,52,Defense Nuclear Facilities Safety Board,Defense Nuclear Facilities Safety Board,,Defense Nuclear Facilities Safety Board,,,,Defense Nuclear Facilities Safety Board,3155,3155,DNFSB,,53,Delta Regional Authority,,,Delta Regional Authority,,,,Delta Regional Authority,,,DRA,,54,Department of Agriculture,Department of Agriculture,department of agriculture,DEPARTMENT OF AGRICULTURE,Department of Agriculture,,Department of Agriculture,Department of Agriculture,500,500,USDA,,55,Department of Commerce,Department of Commerce,department of commerce,DEPARTMENT OF COMMERCE,Department of Commerce,,Department of Commerce,Department of Commerce,600,600,,,56,Department of Defense,Department of Defense,department of defense,DEPARTMENT OF DEFENSE,Department of Defense,,Department of Defense,Department of Defense,700,700,DOD,,57,Department of Education,Department of Education,department of education,DEPARTMENT OF EDUCATION,Department of Education,,Department of Education,Department of Education,1800,1800,ED,,58,Department of Energy,Department of Energy,department of energy,DEPARTMENT OF ENERGY,Department of Energy,,Department of Energy,Department of Energy,1900,1900,DOE,Energy Department,59,Department of Health and Human Services,Department of Health and Human Services,department of health and human services,DEPARTMENT OF HEALTH AND HUMAN SERVICES,Department of Health and Human Services,,Department of Health and Human Services,Department of Health and Human Services,900,900,DHHS,Health and Human Services,HHS60,Department of Homeland Security,Department of Homeland Security,DHS,Department of Homeland Security,DHS,,Department of Homeland Security,Department of Homeland Security,1600,1600,DHS,Homeland Security,61,Department of Housing and Urban Development,Department of Housing and Urban Development,department of housing and urban developm,DEPARTMENT OF HOUSING AND URBAN DEVELOPM,Department of Housing and Urban Development,,Department of Housing and Urban Development,Department of Housing and Urban Development,2500,2500,HUD,Housing and Urban Development,62,Department of Justice,Department of Justice,department of justice,DEPARTMENT OF JUSTICE,Department of Justice,,Department of Justice,Department of Justice,1100,1100,DOJ,Justice Department,63,Department of Labor,Department of Labor,department of labor,DEPARTMENT OF LABOR,Department of Labor,,Department of Labor,Department of Labor,1200,1200,DOL,Labor Department,64,Department of State,Department of State,department of state,DEPARTMENT OF STATE,Department of State,,Department of State,Department of State,1400,1400,,State Department,65,Department of the Air Force,Department of the Air Force,department of the air force,DEPARTMENT OF THE AIR FORCE,,,Department of the Air Force,Department of Defense,701,700,,Air Force,66,Department of the Army,Department of the Army,department of the army,DEPARTMENT OF THE ARMY,,,Department of the Army,Department of Defense,702,700,,Army,67,Department of the Interior,Department of the Interior,department of interior,DEPARTMENT OF INTERIOR,Department of the Interior,,Department of the Interior,Department of the Interior,1000,1000,DOI,Department of Interior,68,Department of the Navy,Department of the Navy,department of the navy,DEPARTMENT OF THE NAVY,,,Department of the Navy,Department of Defense,703,700,,Navy,69,Department of the Treasury,Department of the Treasury,department of treasury,Department of the Treasury,DEPARTMENT OF TREASURY,,Department of the Treasury,Department of the Treasury,1500,1500,TREAS,Treasury Department,70,Department of Transportation,Department of Transportation,department of transportation,DEPARTMENT OF TRANSPORTATION,Department of Transportation,,Department of Transportation,Department of Transportation,2100,2100,DOT,Transportation Department,71,Department of Veterans Affairs,Department of Veterans Affairs,VA,Department of Veterans Affairs,VA,,Department of Veterans Affairs,Department of Veterans Affairs,2900,2900,VA,,72,"District of Columbia Offender Supervision, Defender, and Courts Services Agency",,,"District of Columbia Offender Supervision, Defender, and Courts Services Agency",,,,"District of Columbia Offender Supervision, Defender, and Courts Services Agency",,,CSOSA,Court Services and Offender Supervision,"Offender Supervision, Defender, and Courts Services Agency"73,DOD/GSA/NASA (FAR),,,,,,,DOD/GSA/NASA (FAR)FAR,9000,,,DOD/GSA/NASA,74,Drug Enforcement Administration,,,,,,Drug Enforcement Administration,Department of Justice,1117,1100,DEA,,75,"Economic Growth, Energy, and the Environment",,,,,,"Economic Growth, Energy, and the Environment",Department of State,,,,,76,Election Assistance Commission,,,Election Assistance Commission,,,,Election Assistance Commission,,,EAC,,77,Employment and Training Administration,,,,,,Employment and Training Administration,Department of Labor,1205,1200,ETA,,78,Energy Information Administration,,,,,,Energy Information Administration,Department of Energy,1905,1900,EIA,,79,Energy R&D Administration,,energy r&d administration,,,,,Department of Energy,,,,,80,Environmental Protection Agency,Environmental Protection Agency,environmental protection agency,ENVIRONMENTAL PROTECTION AGENCY,Environmental Protection Agency,,Environmental Protection Agency,Environmental Protection Agency,2000,2000,EPA,,81,Equal Employment Opportunity Commission,Equal Employment Opportunity Commission,equal employment opportunity commission,EQUAL EMPLOYMENT OPPORTUNITY COMMISSION,Equal Employment Opportunity Commission,,Equal Employment Opportunity Commission,Equal Employment Opportunity Commission,3046,3046,EEOC,,82,European Bank for Reconstruction and Development,,,European Bank for Reconstruction and Development,,,,European Bank for Reconstruction and Development,,,EBRD,,83,Executive Office for United States Attorneys,,,,,,Executive Office for United States Attorneys,Department of Justice,,,USAO,Office for United States Attorneys,84,Executive Office of the President,,,EXECUTIVE OFFICE OF THE PRESIDENT,Executive Office of the President,,,Executive Office of the President,300,300,EOP,,85,Executive Residence at the White House,Executive Residence at the White House,,,,,,Executive Office of the President,,,,Residence at the White House,86,Export-Import Bank of the United States,Export Import Bank of the United States,export-import bank of the united states,Export-Import Bank of the United States,,,Export-Import Bank of the U.S.,Export-Import Bank of the United States,3048,3048,EXIM,Export-Import Bank,87,Farm Credit Administration,Farm Credit Administration,farm credit administration,FARM CREDIT ADMINISTRATION,Farm Credit Administration,,Farm Credit Administration,Farm Credit Administration,3052,3052,FCA,,88,Farm Credit System Insurance Corporation,,,,,,,Farm Credit System Insurance Corporation,3055,,FCSIC,,89,Farm Service Agency,,,,,,Farm Service Agency,Department of Agriculture,560,500,FSA,,90,Federal Agricultural Mortgage Corporation,,,,,,,Federal Agricultural Mortgage Corporation,,,FAMC,Farmer Mac,91,Federal Aviation Administration,,,,,,Federal Aviation Administration,Department of Transportation,2120,2100,FAA,,92,Federal Bureau of Investigation,,,,,,Federal Bureau of Investigation,Department of Justice,1110,1100,FBI,,93,Federal Communications Commission,Federal Communications Commission,federal communications commission,FEDERAL COMMUNICATIONS COMMISSION,Federal Communications Commission,,Federal Communications Commission,Federal Communications Commission,3060,3060,FCC,,94,Federal Deposit Insurance Corporation,Federal Deposit Insurance Corporation,federal deposit insurance corporation,FEDERAL DEPOSIT INSURANCE CORPORATION,Federal Deposit Insurance Corporation,,Federal Deposit Insurance Corporation,Federal Deposit Insurance Corporation,3064,3064,FDIC,,95,Federal Election Commission,Federal Election Commission,federal election commission,Federal Election Commission,,,Federal Election Commission,Federal Election Commission,,,FEC,,96,Federal Emergency Management Agency,Federal Emergency Management Agency,federal emergency management agency,Federal Emergency Management Agency,,,Federal Emergency Management Agency,Department of Homeland Security,3067,1600,FEMA,,97,Federal Energy Regulatory Commission,,,FEDERAL ENERGY REGULATORY COMMISSION,Federal Energy Regulatory Commission,,Federal Energy Regulatory Commission,Department of Energy,1902,1900,FERC,,98,Federal Highway Administration,,,,,,Federal Highway Administration,Department of Transportation,2125,2100,FHWA,,99,Federal Home Loan Mortgage Corporation,,,,,,Federal Home Loan Mortgage Corporation,Federal Home Loan Mortgage Corporation,,,FHLMC,Freddie Mac,100,Federal Hospital Insurance Trust Fund Board ,,,Federal Hospital Insurance Trust Fund,,,,Federal Hospital Insurance Trust Fund Board ,,,,Hospital Insurance Trust Fund Board ,101,Federal Housing Administration,,,,,,Federal Housing Administration,Department of Housing and Urban Development,,,FHA,Housing Administration,102,Federal Housing Finance Agency,Federal Housing Finance Board,federal housing finance board,Federal Housing Finance Agency,FEDERAL HOUSING FINANCE BOARD,Federal Housing Finance Board,Federal Housing Finance Agency,Federal Housing Finance Agency,3069,3069,FHFB,Housing Finance Agency,103,Federal Housing Finance Agency,,,,,,,Federal Housing Finance Agency,2590,,FHFA,,104,Federal Insurance Trust Fund,,,Federal Insurance Trust Fund,,,,Federal Insurance Trust Fund,,,,Insurance Trust Fund,105,Federal Labor Relations Authority,Federal Labor Relations Authority,federal labor relations authority,FEDERAL LABOR RELATIONS AUTHORITY,Federal Labor Relations Authority,,Federal Labor Relations Authority,Federal Labor Relations Authority,3070,3070,FLRA,Labor Relations Authority,106,Federal Maritime Commission,Federal Maritime Commission,federal maritime commission,FEDERAL MARITIME COMMISSION,Federal Maritime Commission,,Federal Maritime Commission,Federal Maritime Commission,3072,3072,FMC,Maritime Commission,107,Federal Mediation and Conciliation Service,Federal Mediation and Conciliation Service,federal mediation and conciliation service,Federal Mediation and Conciliation Service,,,Federal Mediation and Conciliation Service,Federal Mediation and Conciliation Service,3076,3076,FMCS,Mediation and Conciliation Service,108,Federal Mine Safety and Health Administration,,,Federal Mine Safety and Health Administration,,,Mine Safety and Health Administration,Department of Labor,1219,1200,MSHA,Mine Safety and Health Administration,109,Federal Mine Safety and Health Review Commission,Federal Mine Safety and Health Review Commission,,FEDERAL MINE SAFETY AND HEALTH REVIEW COMMISSION,,,,Federal Mine Safety and Health Review Commission,3079,3079,FMSHRC,Mine Safety and Health Review Commission,110,Federal Motor Carrier Safety Administration,,,,,,Federal Motor Carrier Safety Administration,Department of Transportation,2126,2100,FMCSA,,111,Federal National Mortgage Association,,,,,,Federal National Mortgage Association,Federal National Mortgage Association,,,FNMA,Fannie Mae,112,Federal Reserve ,,federal reserve,Federal Reserve System,,,The Federal Reserve,Federal Reserve ,7100,7100,FRS,,113,Federal Retirement Thrift Investment Board,Federal Retirement Thrift Investment Board,,Federal Retirement Thrift Investment Board,,,,Federal Retirement Thrift Investment Board,,,FRTIB,Retirement Thrift Investment Board,114,Federal Supplementary Medication Insurance Trust Fund Board,,,,,,,Federal Supplementary Medication Insurance Trust Fund Board,,,,Supplementary Medication Insurance Trust Fund Board,115,Federal Trade Commission,Federal Trade Commission,federal trade commission,FEDERAL TRADE COMMISSION,Federal Trade Commission,,Federal Trade Commission,Federal Trade Commission,3084,3084,FTC,,116,Federal Transit Administration,,,,,,Federal Transit Administration,Department of Transportation,2132,2100,FTA,,117,Financial Crimes Enforcement Network,,,,,,Financial Crimes Enforcement Network,Department of the Treasury,1506,1500,FinCEN,,118,Financial Stability Oversight Council,,,,,,,Financial Stability Oversight Council,4030,,FSOC,,119,Food and Drug Administration,,,,,,Food and Drug Administration,Department of Health and Human Services,910,900,FDA,,120,Food and Nutrition Service,,,,,,Food and Nutrition Service,Department of Agriculture,584,500,FNS,,121,Food Safety and Inspection Service,,,,,,Food Safety and Inspection Service,Department of Agriculture,583,500,FSIS,,122,Foreign Claims Settlement Commission of the United States,,,Foreign Claims Settlement Commission,,,,Foreign Claims Settlement Commission of the United States,,,FCSC,Foreign Claims Settlement Commission,123,Forest Service,,,,,,Forest Service,Department of Agriculture,596,500,,,124,General Accounting Office,,general accounting office,,,,,General Accounting Office,,,GAO,,125,General Services Administration,General Services Administration,general services administration,GENERAL SERVICES ADMINISTRATION,General Services Administration,,General Services Administration,General Services Administration,3090,3090,GSA,,126,Government National Mortgage Association,,,,,,Government National Mortgage Association,Department of Housing and Urban Development,2503,2500,GNMA,Ginnie Mae,127,Government Printing Office,,government printing office,Government Printing Office,,,,Government Printing Office,,,GPO,,128,Gulf Coast Ecosystem Restoration Council,,,,,,,Gulf Coast Ecosystem Restoration Council,3600,,,,129,Harry S Truman Scholarship Foundation,,,Harry S Truman Scholarship Foundation,,,,Harry S Truman Scholarship Foundation,3111,3111,,Truman Scholarship Foundation,130,Health Resources and Services Administration,,,,,,Health Resources and Services Administration,Department of Health and Human Services,906,900,HRSA,,131,Independent Payment Advisory Board,,,,,,,Independent Payment Advisory Board,,,IPAB,Payment Advisory Board,132,Indian Health Service,,,,,,Indian Health Service,Department of Health and Human Services,917,900,HIS,,133,Institute for Museum and Library Services,,,Institute of Museum and Library Services,,,,Institute for Museum and Library Services,3137,3137,IMLS,,134,Institute of American Indian Arts,,,Institute of American Indian & Alaska Native Culture & Arts Development,,,,Institute of American Indian Arts,,,IAIA,,135,Institute of Education Sciences,,,,,,Institute of Education Sciences,Department of Education,1850,1800,IES,,136,Inter-American Foundation,InterAmerican Foundation,inter-american foundation,Inter-American Foundation,,,,Inter-American Foundation,417,417,IAF,,137,Internal Revenue Service,,,,,,Internal Revenue Service,Department of the Treasury,1545,1500,IRS,,138,Internal Revenue Service Oversight Board,,,,,,,Internal Revenue Service Oversight Board,,,,,139,International Atomic Energy Agency,,,International Atomic Energy Agency,,,,International Atomic Energy Agency,,,IAEA,,140,International Bank for Reconstruction and Development,,,International Bank for Reconstruction and Development,,,,International Bank for Reconstruction and Development,,,IBRD,,141,International Communication Agency,,international communication agency,,,,,International Communication Agency,,,,,142,"International Joint Commission, United States and Canada",,,"International Joint Commission, United States and Canada",,,,"International Joint Commission, United States and Canada",,,IJC,International Joint Commission,143,International Monetary Fund,,,International Monetary Fund,,,,International Monetary Fund,,,IMF,,144,International Trade Administration,,,,,,International Trade Administration,Department of Commerce,625,600,ITA,,145,Interstate Commerce Commission,Interstate Commerce Commission,interstate commerce commission,,,,,Interstate Commerce Commission,3120,3120,ICC,,146,James Madison Memorial Fellowship Foundation,,,James Madison Memorial Fellowship Foundation,,,,James Madison Memorial Fellowship Foundation,3020,3020,,Madison Memorial Fellowship Foundation,Madison Fellowship Foundation147,Joint Chiefs of Staff,,,,,,Joint Chiefs of Staff,Department of Defense,,,,,148,Legal Services Corporation,,,Legal Services Corporation,,,Legal Services Corporation,Legal Services Corporation,3122,3122,LSC,,149,Library of Congress,,library of congress,,,,,Library of Congress,,,,,150,Merit Systems Protection Board,Merit Systems Protection Board,merit systems protection board,MERIT SYSTEMS PROTECTION BOARD,Merit Systems Protection Board,,Merit Systems Protection Board,Merit Systems Protection Board,3124,3124,MSPB,,151,Metropolitan Washington Airport Authority,,,Metropolitan Washington Airports Authority,,,,Metropolitan Washington Airport Authority,,,MWAA,,152,Millennium Challenge Corporation,,,MILLENNIUM CHALLENGE CORPORATION,Millennium Challenge Corporation,,Millennium Challenge Corporation,Millennium Challenge Corporation,,,MCC,,153,Missile Defense Agency,,,,,,Missile Defense Agency,Department of Defense,,,,,154,Mississippi River Commission,,,Mississippi River Commission,,,,US Army Corps of Engineers,,,MRC,,155,Morris K. Udall Scholarship Foundation,,,Morris K. Udall Scholarship and Excellence in National Environmental Policy Foundation,,,,Morris K. Udall Scholarship Foundation,3320,3320,,Udall Scholarship Foundation,156,National Aeronautics and Space Administration,National Aeronautics and Space Administration,national aeronautics and space administration,NATIONAL AERONAUTICS AND SPACE ADMINISTRATION,National Aeronautics and Space Administration,,National Aeronautics and Space Administration,National Aeronautics and Space Administration,2700,2700,NASA,,157,National Agricultural Statistics Service,,,,,,National Agricultural Statistics Service,Department of Agriculture,535,500,NASS,Agricultural Statistics Service,158,National Archives and Records Administration,National Archives and Records Administration,national archives and records administration,NATIONAL ARCHIVES AND RECORDS ADMINISTRATION,National Archives and Records Administration,,National Archives and Records Administration,National Archives and Records Administration,3095,3095,NARA,Archives and Records Administration,159,National Board for Education Sciences,,,National Board for Education Sciences,,,,Department of Education,,,,Board for Education Sciences,160,National Capital Planning Commission,National Capital Planning Commission,,,,,,National Capital Planning Commission,,,NCPC,Capital Planning Commission,